{
  "system": "maximo",
  "object_structure": "DMD_OPLOGABN",
  "resource": "dmdoplogabn",
  "status": "documented",
  "access": "error",
  "endpoint": "/oslc/os/DMD_OPLOGABN?_maxitems=1&oslc.where=siteid%3D%22BSR%22&oslc.select=href",
  "primary_key": null,
  "field_candidates": [],
  "important_fields": [],
  "field_types": {},
  "metadata_fields": [],
  "pagination": {},
  "sample": null,
  "use_cases": [],
  "relationships": [],
  "notes": [
    "describe GET failed: response exceeded MAXIMO_MAX_RESPONSE_BYTES (1048576)",
    "catalog GET returned HTTP 400; using documented seed",
    "catalog selection used explicit MX-006B allowlisted targets"
  ],
  "verified_at": null,
  "scope": {
    "field": "siteid",
    "value": "BSR",
    "status": "PRIOR_LIVE_QUERY",
    "evidence": "MX-006R used this BSR-scoped clause and received a bounded response; detail field evidence remains required."
  },
  "detail_dereference": {
    "attempted": false,
    "collection_records": 0,
    "detail_records": 0,
    "maximum_dereference_depth": 1,
    "pagination_followed": false
  },
  "http_diagnostics": {},
  "catalog_source": "seed-fallback"
}
