{
  "system": "maximo",
  "object_structure": "mxapiasset",
  "resource": "asset",
  "endpoint": "/oslc/os/mxapiasset",
  "primary_key": "assetnum",
  "use_cases": [
    "asset-reliability",
    "asset-history"
  ],
  "relationships": [
    "parent -> asset (asset hierarchy; verified field)",
    "ancestor -> asset (asset hierarchy; verified field)",
    "children -> asset (asset hierarchy; verified field)",
    "failurecode -> failure code (verified field; MXFAILURECODE forbidden)"
  ],
  "notes": [
    "Data scoped to site BSR; always filter oslc.where=siteid=\"BSR\" in the downstream app."
  ],
  "verified_at": "2026-08-12T11:26:12Z",
  "status": "verified",
  "access": "http_200",
  "important_fields": [
    "parent",
    "ytdcost",
    "installdate",
    "assettype_description",
    "moddowntimehist",
    "moved",
    "eq5",
    "pluscismte",
    "eq9",
    "eq8",
    "pluscisinhousecal",
    "totalcost",
    "totunchargedcost",
    "children",
    "tloampartition",
    "eq11_description",
    "siteid",
    "unchargedcost",
    "plusgistemp",
    "href",
    "removefromactivesp",
    "assetspec_collectionref",
    "mainthierchy",
    "status_description",
    "returnedtovendor",
    "changepmstatus",
    "ancestor",
    "changedate",
    "replacecost",
    "orgid",
    "pluscsolution",
    "removefromactiveroutes",
    "rolltoallchildren",
    "downtimereport_collectionref",
    "plant",
    "serviceaddress_collectionref",
    "status",
    "assetmeter_collectionref",
    "islinear",
    "eq23",
    "hierarchypath",
    "iscalibration",
    "downtimereport",
    "description",
    "manufacturer",
    "totdowntime",
    "plusgexregistered",
    "pluscpmextdate",
    "vendor",
    "assetnum",
    "plusciscontam",
    "assetspec",
    "disabled",
    "doclinks",
    "assettype",
    "eq11",
    "plant_description",
    "eq10",
    "changeby",
    "moddowntimehist_collectionref",
    "expectedlife",
    "plusgleaking",
    "invcost",
    "newsite",
    "purchaseprice",
    "statusdate",
    "issafety",
    "plusgispassvalve",
    "isrunning",
    "budgetcost",
    "assetid",
    "location",
    "autowogen"
  ],
  "field_candidates": [
    "siteid",
    "orgid",
    "assetnum",
    "assetid"
  ],
  "pagination": {
    "method": "oslc.paging + pageno + oslc.pageSize",
    "single_record_via": "resource href"
  },
  "sample": null,
  "catalog_source": "oslc-catalog",
  "data_scope": "BSR (org IP)"
}
