{
  "system": "maximo",
  "object_structure": "mxapisr",
  "resource": "sr",
  "endpoint": "/oslc/os/mxapisr",
  "primary_key": "ticketid",
  "use_cases": [
    "service-request-tracking"
  ],
  "relationships": [
    "assetnum -> asset (foreign key to MXASSET; verified field)",
    "location -> location (foreign key to LOCHIERARCHY; verified field; MXAPILOCATION forbidden)",
    "worklog_collectionref -> work logs (verified collectionref)",
    "ticketspec_collectionref -> ticket specifications (verified collectionref)",
    "classstructure_collectionref -> class structure (verified collectionref)",
    "site_collectionref -> site (verified collectionref)"
  ],
  "notes": [
    "Data scoped to site BSR; always filter oslc.where=siteid=\"BSR\" in the downstream app."
  ],
  "verified_at": "2026-08-12T11:26:12Z",
  "status": "verified",
  "access": "http_200",
  "important_fields": [
    "affecteddate",
    "historyflag",
    "site_collectionref",
    "ticketuid",
    "plusgrelatetolocal",
    "shift",
    "plusgisreviewreqd",
    "plusgislesslearned",
    "sitevisit",
    "plusgrcfaapp",
    "href",
    "reportedbyname",
    "reportedpriority",
    "worklog_collectionref",
    "actlabhrs",
    "subseksi",
    "worktype_description",
    "plusganalysiscomp",
    "plusgislocal",
    "plusgreportable",
    "seksi_description",
    "status",
    "plusgisinvestig",
    "template",
    "reportedpriority_description",
    "inheritstatus",
    "class_description",
    "reportedby",
    "plusgisdefect",
    "assetnum",
    "assetsiteid",
    "doclinks",
    "ticketid",
    "description_longdescription",
    "changeby",
    "actualfinish",
    "cxarlingkungan",
    "hasactivity",
    "statusdate",
    "site",
    "cxarreputasi",
    "hassolution",
    "plusghfapp",
    "plusghighcontext",
    "actlabcost",
    "createwomulti_description",
    "internalpriority",
    "cxarmanusia",
    "plusgmigrationreq",
    "subseksi_description",
    "cxarproses",
    "actualstart",
    "siteid",
    "isknownerror",
    "plusgrootcauseiden",
    "affectedperson",
    "affectedphone",
    "status_description",
    "plusghassafetycrit",
    "tktemplate_collectionref",
    "targetstart",
    "changedate",
    "plusgreltoregional",
    "unit_description",
    "plusgmanhf",
    "orgid",
    "createwomulti",
    "unit",
    "plusgmanrcfa",
    "plusgglobalincident",
    "selfservsolaccess",
    "reportdate",
    "plusgdefectelim",
    "description",
    "classstructure_collectionref",
    "shift_description",
    "cxhubpekerjaan",
    "reportedphone",
    "class",
    "plusgfailfix",
    "plusgnonconaccept",
    "assetorgid",
    "plusgstrategic",
    "plusgacceptinc",
    "internalpriority_description",
    "ticketspec_collectionref",
    "worktype",
    "seksi",
    "plusgisregional",
    "relatedtoglobal",
    "targetfinish",
    "glaccount",
    "plusginvestreqd",
    "location",
    "isglobal",
    "cxgmappr"
  ],
  "field_candidates": [
    "ticketuid",
    "assetnum",
    "assetsiteid",
    "ticketid",
    "siteid",
    "orgid",
    "assetorgid"
  ],
  "pagination": {
    "method": "oslc.paging + pageno + oslc.pageSize",
    "single_record_via": "resource href"
  },
  "sample": null,
  "catalog_source": "oslc-catalog",
  "data_scope": "BSR (org IP)"
}
