{
  "system": "maximo",
  "object_structure": "mxasset",
  "resource": "asset",
  "endpoint": "/oslc/os/mxasset",
  "primary_key": "assetnum",
  "use_cases": [
    "asset-reliability",
    "asset-history"
  ],
  "relationships": [
    "parent -> asset (asset hierarchy; verified field)",
    "ancestor -> asset (asset hierarchy; verified field)",
    "children -> asset (asset hierarchy; verified field)",
    "assetspec_collectionref -> asset specs (verified collectionref)",
    "assetmeter_collectionref -> meter (verified collectionref; MXAPIMETER forbidden)",
    "assetusercust_collectionref -> asset users/custodians (verified collectionref)",
    "assetmntskd_collectionref -> asset maintenance schedule (verified collectionref)",
    "assetopskd_collectionref -> asset operating schedule (verified collectionref)",
    "failurecode -> failure code (verified field; MXFAILURECODE forbidden)"
  ],
  "notes": [
    "Data scoped to site BSR; always filter oslc.where=siteid=\"BSR\" in the downstream app."
  ],
  "verified_at": "2026-08-12T11:26:12Z",
  "status": "verified",
  "access": "http_200",
  "important_fields": [
    "parent",
    "ytdcost",
    "installdate",
    "assettype_description",
    "moved",
    "eq5",
    "pluscismte",
    "eq9",
    "eq8",
    "pluscisinhousecal",
    "totalcost",
    "totunchargedcost",
    "children",
    "tloampartition",
    "eq11_description",
    "siteid",
    "unchargedcost",
    "href",
    "removefromactivesp",
    "assetspec_collectionref",
    "mainthierchy",
    "status_description",
    "mainstr_description",
    "returnedtovendor",
    "changepmstatus",
    "ancestor",
    "changedate",
    "replacecost",
    "priority",
    "orgid",
    "pluscsolution",
    "removefromactiveroutes",
    "rolltoallchildren",
    "plant",
    "assetopskd_collectionref",
    "status",
    "assetmeter_collectionref",
    "islinear",
    "eq23",
    "iscalibration",
    "description",
    "assetusercust_collectionref",
    "mainstr",
    "totdowntime",
    "plusgexregistered",
    "pluscpmextdate",
    "assetnum",
    "plusciscontam",
    "disabled",
    "assettype",
    "eq11",
    "plant_description",
    "eq10",
    "changeby",
    "plusgopenomuid",
    "plusgleaking",
    "invcost",
    "newsite",
    "purchaseprice",
    "statusdate",
    "issafety",
    "plusgispassvalve",
    "isrunning",
    "budgetcost",
    "failurecode",
    "assetid",
    "assetmntskd_collectionref",
    "location",
    "autowogen"
  ],
  "field_candidates": [
    "siteid",
    "orgid",
    "assetnum",
    "plusgopenomuid",
    "failurecode",
    "assetid"
  ],
  "pagination": {
    "method": "oslc.paging + pageno + oslc.pageSize",
    "single_record_via": "resource href"
  },
  "sample": {
    "parent": "CS10CV-001",
    "ytdcost": 0.0,
    "installdate": "2011-08-22T00:00:00+07:00",
    "assettype_description": "Production Assets",
    "moved": false,
    "eq5": "6484291K3",
    "pluscismte": false,
    "eq9": "BSR20/12079",
    "eq8": "0.0",
    "pluscisinhousecal": false,
    "totalcost": 0.0,
    "totunchargedcost": 0.0,
    "children": true,
    "tloampartition": false,
    "eq11_description": "Unit 1",
    "siteid": "BSR",
    "unchargedcost": 0.0,
    "href": "http://maximo.plnindonesiapower.co.id/maximo/oslc/os/mxasset/_Q1MxMENWQTAyR0EwMDAtMDAxL0JTUg--",
    "removefromactivesp": false,
    "assetspec_collectionref": "http://maximo.plnindonesiapower.co.id/maximo/oslc/os/mxasset/_Q1MxMENWQTAyR0EwMDAtMDAxL0JTUg--/assetspecclass",
    "mainthierchy": false,
    "status_description": "Decommissioned",
    "mainstr_description": "Preventive Maintenance",
    "returnedtovendor": false,
    "changepmstatus": false,
    "ancestor": "CS-001",
    "changedate": "2020-03-12T11:19:30+07:00",
    "replacecost": 0.0,
    "priority": 1,
    "orgid": "IP",
    "pluscsolution": false,
    "removefromactiveroutes": false,
    "rolltoallchildren": false,
    "plant": "TU",
    "assetopskd_collectionref": "http://maximo.plnindonesiapower.co.id/maximo/oslc/os/mxasset/_Q1MxMENWQTAyR0EwMDAtMDAxL0JTUg--/assetopskd",
    "status": "DECOMMISSIONED",
    "assetmeter_collectionref": "http://maximo.plnindonesiapower.co.id/maximo/oslc/os/mxasset/_Q1MxMENWQTAyR0EwMDAtMDAxL0JTUg--/int_assetmeter",
    "islinear": false,
    "eq23": "2017-04-05T00:00:00+07:00",
    "iscalibration": false,
    "description": "JUNCTION BOX OF BOILER HOUSE",
    "assetusercust_collectionref": "http://maximo.plnindonesiapower.co.id/maximo/oslc/os/mxasset/_Q1MxMENWQTAyR0EwMDAtMDAxL0JTUg--/assetusercust",
    "mainstr": "PM",
    "totdowntime": 0.0,
    "plusgexregistered": false,
    "pluscpmextdate": false,
    "assetnum": "CS10CVA02GA000-001",
    "plusciscontam": false,
    "disabled": false,
    "assettype": "PRODUCTION",
    "eq11": "CS01",
    "plant_description": "Pembangkit Listrik Tenaga Uap (PLTU)",
    "eq10": "HIJAU",
    "changeby": null,
    "plusgopenomuid": null,
    "plusgleaking": false,
    "invcost": 0.0,
    "newsite": "BSR",
    "purchaseprice": 0.0,
    "statusdate": "2020-03-12T11:19:30+07:00",
    "issafety": false,
    "plusgispassvalve": false,
    "isrunning": true,
    "budgetcost": 0.0,
    "failurecode": "IP-PNLELC",
    "assetid": 231317,
    "assetmntskd_collectionref": "http://maximo.plnindonesiapower.co.id/maximo/oslc/os/mxasset/_Q1MxMENWQTAyR0EwMDAtMDAxL0JTUg--/assetmntskd",
    "location": "BHAR",
    "autowogen": false
  },
  "catalog_source": "oslc-catalog",
  "data_scope": "BSR (org IP)"
}
